Card ID,Name,Game,Card Type,Cycle,Card Size,Found In,Used For,BP Level,AT/GT?,AT/GT,Resources,Non-Response Text,Responses,Crit Lore,Crit Response,FAQ,Errata
BS1141,Aeacus's Grimace,Odyssey,BP,Cycle II,Standard,,The Burden,II,AT,10,2 Retractable Mechanism. 2 Reliefshell Fragment.,Hardened This BP has +2 AT. Ignore this ability if you rolled a Crit Chance.,Fail Gain DangerIcon equal to your FateIcon. :Wound Gain +2 RageIcon and +2 Danger.,"As you hit the monster's side repeatedly, the visage of Aeacus cracks, then shatters. Stone fragments fall to the ground, a strange spherical stone among them.","Gain the Sisyphus Burden GearIcon card (Secret deck 5, card 60)!",,
BS1142,Imposter's Sneer,Odyssey,BP,Cycle II,Standard,,The Burden,II,AT,8,4 Retractable Mechanism.,,Fail Draw a Moiros card. :Wound Gain +2 DangerIcon and the Sisyphean Condition card.,You slash the False King's visage until not a trace of his identity remains. Who is laughing now?,Reset Fate to 0.,,
BS1143,Rhadamanthus's Scowl,Odyssey,BP,Cycle II,Standard,,The Burden,III,AT,13,4 Reliefshell Fragment.,,Fail Draw an Obol. :Wound Gain +3 RageIcon and +3 DangerIcon.,"You split the dour face right through the middle. From the fissure, a forgotten memory erupts, blinding you momentarily.","Gain 1 unclaimed Mnemos card from the previous Cycle. If you already have 2 Mnemos cards, the card goes to the Mnemos Vault.",,
BS1144,Tripod Nexus,Odyssey,BP,Cycle II,Standard,,The Burden,III,AT,15,2 Retractable Mechanism. 4 Reliefshell Fragment.,,Fail Gain +3 DangerIcon. Kickback 10. :Wound Burden moves to the center of the Board.,"You destroy the mechanical part of the monster. As it shakes and rotates uncontrollably, visions pass before your and your companions' eyes.",Each Argonaut gains +1 Mnemos node for a chosen Mnemos!,,
BS1145,Lacrimal Remnant,Odyssey,BP,Cycle II,Standard,,The Burden,III,AT,12,2 Retractable Mechanism. 2 Reliefshell Fragment.,,Fail Burden steals your Mnemos card. :Wound Gain as many DangerIcon as there are Kratos tokens in the Kratos Pool.,"Under the barrage of your attacks, the relief shell fractures. One of the many visages sheds a singular clear teardrop.",Gain 1 Sisyphus Tear!,,
BS1146,Hoard Of Recollections,Odyssey,BP,Cycle II,Standard,,The Burden,III,AT,14,4 Retractable Mechanism. 2 Reliefshell Fragment.,Hardened This BP has +2 AT. Ignore this ability if you rolled a Crit Chance.,Fail Burden steals 2 of your Mnemos nodes. :Wound Gain +3 FateIcon and a Fated Mnemos card.,"You rip open the Burden's undercarriage, yet not a single drop of ambrosia spills. Instead, the creature leaks stolen memories.","The Moirai Vault is broken, you regain everything that was stolen! If the Vault is empty, gain +1 ArgoKnowledge!",,
BS1147,The Hidden Grin,Odyssey,BP,Cycle II,Standard,,The Burden,III,AT,12,2 Retractable Mechanism. 2 Reliefshell Fragment.,,Fail You die. :Wound Draw and perform an AI card.,"The monstrous creature seems to gloat at its inevitable victory, yet you see through that facade and wipe the smile of its face with one fateful blow.",The Burden crumbles and dies!,,
BS1148,Depthless Pool,Odyssey,BP,Cycle II,Standard,,The Burden,III,AT,12,4 Reliefshell Fragment.,Hardened This BP has +2 AT. Ignore this ability if you rolled a Crit Chance.,Fail Gain as many Ambrosia tokens as Power missing to successfully :Wound after the Power Roll. :Wound Gain 3 Ambrosia tokens.,"You stare into the impenetrable blackness of the Ambrosia Pool, as if you were looking into the Abyss itself. Someone cries for help. You reach out and pull them out of the Void.",The Titan that died most recently (during any game phase) is returned to you and will be available after this Battle!,,
CV1809,Delicate Stomach,Odyssey,BP,Cycle III,Standard,Envelope 2,The Pitiless,,,9,,"Do not escalate. If this BP has been Wounded and there are no cards in the deck, see 0203.",Fail Perform Signature against the Attacker. :Wound The Pitiless appears at the closest Sun Circle.,"You put your all into this desperate attack, striking the god just bellow the chest. You think you saw the Olympian's Muscles twitch.",Another Titan may immediately move up to their Speed and perform a Bonus Attack!,,
