Card ID,Name,Game,Render Type,Kintsukuroi,Cycle,Card Size,Found In,Ability 1 Name,Ability 1 Cost,Ability 1,Ability 2 Name,Ability 2 Cost,Ability 2,Ability 3 Name,Ability 3 Cost,Ability 3,FAQ,Errata
BY1048,Argo Payload,Odyssey,Payload,,Cycle II,Mini American,Secret Deck 05,Trireme Spear,3 Mortal resources,Place 3 Opening tokens in the Kratos Pool. Note: Primes on a 5+,Red Fireboat,2 Ambrosia resources,Place 2 Break tokens in the Kratos Pool. Note: Primes on a 5+,,,,,
BY1049,Labyrinthian Payload,Odyssey,Payload,FALSE,Cycle II,Mini American,Secret Deck 05,Maze Fragmentator,1 Infused Mechanism or Fleshy Mantle resource,Fire to give the Primordial 1 negative Precision token,Pyramid Spear,1 Fear Essence or Maze Fragment resource,Fire to give the Primordial 1 negative To Hit token,Thunderram,1 Muscle Cluster or Calcified Knuckle Bone resource,Fire when you attack to gain Pushback 4 and ignore the Lumbering Trait,,
BY1050,Adversary Payload,Odyssey,Payload,FALSE,Cycle II,Mini American,Secret Deck 05,Shieldburster,1 Retractable Mechanism or Reliefshell Fragment resource,Fire to give the Primordial 1 negative AT token until the end of the Round. Note: Primes on a 7+,Hermesian Cutting Beam,1 Grotesque Beak or Powdered Matter resource,Fire to give the Primordial 1 negative Precision token,Black Fireboat,1 Living Abyss or Skin of Malice resource,Fire to palce 5 Fire tokens in the Kratos Pool,,
CY1635,Chronoice Payload,Odyssey,Payload,FALSE,Cycle III,Mini American,Secret Deck 08,Stormbreaker,1 Clothflesh or Eyecluster resource,"When the Timefront advances, lower the advance by 1 + @RedPowerDie",Destroyer,1 Razorclaw or Icarian Feather resource,Remove 1 Adaptation token from the Adaptation Board,Incinerator,1 Writhing Tentacles or Sunburned Skull resource,Place 1 negative @AT token in the Kratos Pool,,
EA2791,Beacon of Light,Odyssey,Payload,TRUE,Cycle V,Mini American,,Ability,,Choose a Titan that is about to perform a Trauma Draw. That Titan gains {Second Chance} for that Draw,We Bring Our Own Light,,"When a Titan dies, regain 1 @Energy for this Argo Ability",,,,,
EA2792,Markerlight,Odyssey,Payload,TRUE,Cycle V,Mini American,,Ability,,Choose a Titan performing an Attack. That Titan gains {Heartseeker} for this Attack,We Bring Our Own Light,,"When a Titan dies, regain 1 @Energy for this Argo Ability",,,,,
EA2793,Flash Aegis,Odyssey,Payload,TRUE,Cycle V,Mini American,,Ability,,Choose a Titan attacked by a Primordial. That Titan gains {Block 1} or {Defy 1} for this Attack,We Bring Our Own Light,,"When a Titan dies, regain 1 @Energy for this Argo Ability",,,,,
EA2794,Flareshot,Odyssey,Payload,TRUE,Cycle V,Mini American,,Ability,,"Ignore Vanish, Fade In, or Black March, or perform a Scan on any Petrified Vent",We Bring Our Own Light,,"When a Titan dies, regain 1 @Energy for this Argo Ability",,,,,