Card ID,Name,Reverse Name,Game,Card Type,Subtype,Cycle,Card Size,Found In,Used For,Flavor,Level,Uber?,Targeting,Pre-Action Effects,Pre-Action WoO?,Move Type,Pre-Attack Effect,Attack Type,Range Size,Attack Banners,Attack Diagram,Laser Count,Dice,Difficulty,Attack Consequences,Pre-After Attack WoO?,After Final?,After Attack Effects,FAQ,Errata
AR0394,Left Hook,,Odyssey,Attack,AI,Cycle I,Standard,,Hekaton,The Hekaton clenches its mighty fist,I,FALSE,"Closest Titan in front, in range. Closest Titan in sight",,TRUE,Move,,Regular,,Fate 3+ +1 d10Icon,,,2,10,Each hit deals 1 DangerIcon,TRUE,FALSE,Knockback 5,,
AR0395,Right Hook,,Odyssey,Attack,AI,Cycle I,Standard,,Hekaton,The Hekaton clenches its mighty fist,I,FALSE,"Closest Titan in front, in range. Closest Titan in sight",,TRUE,Move,,Regular,,Fate 3+ +1 d10Icon,,,2,10,Each hit deals 1 DangerIcon,TRUE,FALSE,Knockback 5,,
AR0396,"One, Two Punch",,Odyssey,Attack,AI,Cycle I,Standard,,Hekaton,"A fist jabs at you from the left, immediately followed by a right cross",I,FALSE,"Closest Titan in front, in range. Closest Titan in sight",,TRUE,Move,,Regular,,Fate 3+ +1 d10Icon,,,2,9,Each hit deals 1 DangerIcon,TRUE,FALSE,Perform Signature,,
AR0397,Thunderpunch,,Odyssey,Attack,AI,Cycle I,Standard,,Hekaton,The Hekaton rears on its hind arms and delivers a powerful downward blow,I,FALSE,"Closest Titan in front, in range. Closest Titan in sight",,TRUE,Move,,Regular,,,,,3,9,Fate 3+ Pushback 3. Each hit deals 1 DangerIcon. WoO Knockdown,FALSE,FALSE,,,
AR0398,Cold Open,,Odyssey,Attack,AI,Cycle I,Standard,,Hekaton,It goes from zero to ten in a heartbeat and the punches keep on coming,I,FALSE,"Closest Titan in front, in range. Closest Titan in sight",,TRUE,Move,,Regular,,Fate 3+ +1 d10Icon,,,4,6,Each hit deals 1 DangerIcon,TRUE,FALSE,Pushback 3,,
AR0399,Smash,,Odyssey,Attack,AI,Cycle I,Standard,,Hekaton,The Hekaton smashes his front hands as if with frustration,I,FALSE,"Priority Target in range. Closest Titan in front, in range. Closest Titan in sight",,TRUE,Move,,Regular,,Fate 3+ +1 d10Icon,,,2,9,Each hit deals 2 DangerIcon,TRUE,FALSE,Knockback 5,,
AR0400,Omnipunch,,Odyssey,Attack,AI,Cycle I,Standard,,Hekaton,"As if it was a sea urchin, the Primordial extends all of its limbs in every direction, punching everything at arms' length",II,FALSE,All adjacent Titans. No Target: Perform Signature,,TRUE,None,,Simultaneous,,,,,3,9,Each hit deals 1 DangerIcon. Fate 4+ 2 DangerIcon instead. WoO Knockback 5,FALSE,FALSE,,,
AR0401,Furious Smash,,Odyssey,Attack,AI,Cycle I,Standard,,Hekaton,The Primordial delivers a blow with its mighty armored fist,II,FALSE,"Priority Target in range. Closest Titan in front, in range. Closest Titan in sight",,TRUE,Move,,Regular,,,,,4,8,Each hit deals 1 DangerIcon. Fate 4+ 2 DangerIcon instead,TRUE,FALSE,Pushback 3,,
AR0402,Rumble Strike,,Odyssey,Attack,AI,Cycle I,Standard,,Hekaton,The Hekaton starts smashin the ground in a rhythmic fashion,II,FALSE,Zone 2,,TRUE,None,,Zone,,,,,2,9,Each hit deals 1 DangerIcon. WoO Knockdown,TRUE,TRUE,Perform Signature,,
AR0403,Chainfist,,Odyssey,Attack,AI,Cycle I,Standard,,Hekaton,The monster cartwheels into you like a giant ball of fists and pain,II,FALSE,"Priority Target in range. Closest Titan in front, in range. Closest Titan in sight",,TRUE,Move,,Regular,,Fate 3+ +1 d10Icon,,,2,9,Each hit deals 1 DangerIcon,TRUE,FALSE,"If DangerIcon was dealt, repeat Chainfist (once)",,
AR0404,Suckerpunch,,Odyssey,Attack,AI,Cycle I,Standard,,Hekaton,It knows where it hurts the most,II,FALSE,"Closest Titan in front, in range. Closest Titan in sight",,TRUE,Move,,Regular,,,,,2,8,Each hit deals 2 DangerIcon. Fate 5+ 3 DangerIcon instead. WoO Knockdown,TRUE,FALSE,Knockback 5,,
AR0405,Solarplexar,,Odyssey,Attack,AI,Cycle I,Standard,,Hekaton,Somehow the creature understands your connection to the Titan and attacks the most vulnerable neural plexus,II,FALSE,"Priority Target in range. Closest Titan in front, in range. Closest Titan in sight",,TRUE,Move,,Regular,,Fate 3+ +1 d10Icon,,,2,8,Each hit deals 2 DangerIcon. WoO Knockdown,TRUE,FALSE,"If 2+ DangerIcon was dealt, draw a Kratos card",,
AR0406,Death From A Hundred Fists,,Odyssey,Attack,AI,Cycle I,Standard,,Hekaton,"Mindless and unrelentless, it comes at you with all of its might. You may endure one, two, ten punches. One hundred is madness",III,FALSE,"Priority Target in range. Closest Titan in front, in range. Closest Titan in sight",,TRUE,Move,,Regular,,,,,5,7,Roll as many additional Evasion Dice as there are hits. Repeat until there are no hits. Then each hit deals 1 DangerIcon. Fate 6+ 2 DangerIcon Instead,TRUE,FALSE,Pushback 4,,
AR0407,Thunderclash,,Odyssey,Attack,AI,Cycle I,Standard,,Hekaton,"The Hekaton winds around, almost turning to you with its side. Then the hook comes knocking",III,FALSE,"Priority Target in range. Closest Titan in front, in range. Closest Titan in sight",,TRUE,Move,,Regular,,,,,2,8,Each hit deals 3 DangerIcon. Fate 6+ 4 DangerIcon instead. WoO Knockdown,TRUE,FALSE,Knockback 8,,
AR0408,Backbreaker,,Odyssey,Attack,AI,Cycle I,Standard,,Hekaton,"One of the mighty front hands bends inwards, almost as if the Hekaton was kneeling. The other hands raise you in the air, then slam down",III,TRUE,"Priority Target in range. Closest Titan in front, in range. Closest Titan in sight",,TRUE,Move,,Regular,,,,,3,9,"Fate 8+ You Die. If you didn't die, each hit deals 2 DangerIcon, then draw an Obol instead of a regular Trauma Draw",TRUE,FALSE,Knockdown,,
AR0409,Solarsuplexar,,Odyssey,Attack,AI,Cycle I,Standard,,Hekaton,It knows you're just controlling the Titan and it intends to break that connection - with flair,III,FALSE,"Priority Target in range. Closest Titan in front, in range. Closest Titan in sight",,TRUE,Move,,Regular,,Fate 7+ +1 d10Icon,,,3,9,Each hit deals 1 DangerIcon. WoO Forced Vault. WoO Knockdown,TRUE,FALSE,"If DangerIcon was dealt, draw a Kratos card",,
AR0410,Skullcrusher,,Odyssey,Attack,AI,Cycle I,Standard,,Hekaton,The mighty hands of the monster clutch your helmeted head and squeeze. The screech of metal is deafening,III,FALSE,"Closest Titan in front, in range. Closest Titan in sight",,TRUE,Move,,Regular,,Fate 8+ +1 d10Icon,,,2,8,Each hit deal 4 dangerIcon. WoO Knockdown,TRUE,FALSE,Knockback 8,,
AR0411,Hekatosmasher,,Odyssey,Attack,AI,Cycle I,Standard,,Hekaton,The Primordial moves all its weight onto one side and delivers the mother of all haymakers,III,FALSE,Zone 3,,TRUE,None,,Zone,,Fate 7+ +1 d10Icon,,,2,8,Each hit deals 2 DangerIcon. WoO Knockdown. WoO Fate 5+ Knockback 5,TRUE,TRUE,Draw another AI card,,
AR0412,Swat,,Odyssey,Attack,Signature,Cycle I,Standard,,Hekaton,The Hekaton does what it was made to do: SMASH!,X,FALSE,"Closest Titan in front, in range. Closest Titan in sight",,TRUE,Move,,Regular,,Fate 3+ +1 d10Icon,,,2,9,Each hit deals 1 DangerIcon,TRUE,FALSE,Knockback 5,,
AR0464,Ram,,Odyssey,Attack,AI,Cycle I,Standard,,Labyrinthauros,,I,FALSE,"Furthest Titan in front, in range. Furthest Titan in sight, in range. Closest Titan in sight.",,TRUE,Move,,Regular,,Fate 3+ +1 d10Icon,,,2,10,Each hit deals 1 DangerIcon,TRUE,FALSE,Trample. Labyrinth 1.,,
AR0465,Ram & Drag,,Odyssey,Attack,AI,Cycle I,Standard,,Labyrinthauros,,I,FALSE,"Furthest Titan in front, in range. Furthest Titan in sight, in range. Closest Titan in sight.",,TRUE,Move,,Regular,,,,,2,9,Each hit deals 1 DangerIcon. Fate 3+ 2 DangerIcon Instead. WoO Knockback 6.,TRUE,FALSE,Trample.,,
AR0466,Stomp,,Odyssey,Attack,AI,Cycle I,Standard,,Labyrinthauros,,I,FALSE,"Closest Knocked down Titan in range. Closest Titan in front, in range. Closest Titan in sight",,TRUE,Move,,Regular,,,,,3,8,Each hit deals 1 DangerIcon. Fate 4+ 2 DangerIcon Instead. WoO Knockdown.,FALSE,FALSE,,,
AR0467,Headbutt,,Odyssey,Attack,AI,Cycle I,Standard,,Labyrinthauros,,I,FALSE,"Closest Titan in front, in range. Closest Titan in sight.",,TRUE,Move,,Regular,,Fate 4+ +1 d10Icon,,,2,9,Each hit deals 2 DangerIcon.,TRUE,FALSE,Labyrinth 1.,,
AR0468,Tunnel Vision,,Odyssey,Attack,AI,Cycle I,Standard,,Labyrinthauros,,I,FALSE,"Priority Target in range. Furthest Titan in sight, in range. Closest Titan in sight.",,TRUE,Move,,Regular,,,,,3,9,Each hit deals 1 DangerIcon. Fate 3+ 2 DangerIcon instead.,TRUE,FALSE,Trample. Labyrinth 1.,,
AR0469,Rampage,,Odyssey,Attack,AI,Cycle I,Standard,,Labyrinthauros,,I,FALSE,"Furthest Titan in front, in range. Furthest Titan in sight, in range. Closest Titan in sight.",,TRUE,,,Sequential,,Fate 3+ +1 d10Icon,,,2,10,Each hit deals 1 DangerIcon,TRUE,TRUE,Trample. Labyrinth 1.,,
AR0470,Supercharger,,Odyssey,Attack,AI,Cycle I,Standard,,Labyrinthauros,,II,FALSE,"Furthest Titan in front, in range. Furthest Titan in sight, in range. Closest Titan in sight.",,TRUE,,,Sequential,,Fate 5+ +1 d10Icon,,,2,9,"Each hit deals 2 DangerIcon. If the labyrinthauros moved through at least 1 Labyrinth tile, 3 DangerIcon instead.",TRUE,TRUE,Trample. Labyrinth 1.,,
AR0471,Encasen,,Odyssey,Attack,AI,Cycle I,Standard,,Labyrinthauros,,II,FALSE,"Priority Target in range, in sight. Closest Titan in range, in sight. No Target: Perform Signature.",,TRUE,Move,,Regular,,,,,3,8,"Each hit deals 1 DangerIcon. Fate 5+ 2 DangerIcon instead. For each hit, Labyrinth 1 (if possible).",TRUE,FALSE,Fate 6+ Perform Signature.,,
AR0472,Roundhouse Kick,,Odyssey,Attack,AI,Cycle I,Standard,,Labyrinthauros,,II,FALSE,All Adjacent Titans. No Target: Perform Signature.,,FALSE,None,,Simultaneous,,,,,2,10,Each hit deals 2 DangerIcon. Fate 5+ Knockdown.,TRUE,TRUE,Trample. Labyrinth 1.,,
AR0473,Gnaw,,Odyssey,Attack,AI,Cycle I,Standard,,Labyrinthauros,,II,FALSE,"Priority Target in range. Closest Knocked down Titan in front, in range. Closest Titan in sight.",,TRUE,Move,,Regular,,,,,2,9,"Each hit deals 3 DangerIcon. Fate 6+ Unless this Attack causes you to go over the Obol threshold, draw a Grave Trauma instead of a regular Trauma Draw,",TRUE,FALSE,Labyrinth 1.,,
AR0474,Frequency Charge,,Odyssey,Attack,AI,Cycle I,Standard,,Labyrinthauros,,II,FALSE,"Furthest Titan in front, in range. Furthest Titan in sight, in range. Closest Titan in sight.",,FALSE,,,Sequential,,,,,3,8,Each hit deals 1 DangerIcon. Fate 6+ 2 DangerIcon instead.,TRUE,TRUE,Trample. Labyrinth 1. Fate 5+ Labyrinth 2 instead.,,
AR0475,Otherworldly Ram,,Odyssey,Attack,AI,Cycle I,Standard,,Labyrinthauros,,II,FALSE,Priority Target. Furthest Titan in sight.,,TRUE,,,Regular,,Fate 6+ +1 d10Icon,,,2,10,Each hit deals 2 DangerIcon.,TRUE,FALSE,Trample. Labyrinth 1. Fate 6+ Labyrinth 2 instead.,,
AR0476,Lightspeed Ram,,Odyssey,Attack,AI,Cycle I,Standard,,Labyrinthauros,,III,FALSE,"Furthest Titan in front, in range. Furthest Titan in sight, in range. Closest Titan in sight.",,FALSE,,,Sequential,,,,,4,9,"Each hit deals 2 DangerIcon. If the labyrinthauros moved through at least 1 Labyrinth tile, 3 DangerIcon instead.",TRUE,TRUE,Trample. Labyrinth 1.,,
AR0477,Minotaur Logic,,Odyssey,Attack,AI,Cycle I,Standard,,Labyrinthauros,,III,FALSE,"Priority Target in range. Closest Titan in front, in range. Closest Titan in sight.",,TRUE,Move,,Regular,,Fate 7+ Gain a Fated Mnemos card,,,2,8,Each hit deals 2 DangerIcon. WoO Gain the Fear Condition card.,TRUE,FALSE,Trample. Labyrinth 1. Fate5+ Labyrinth 2 instead,,
AR0478,Bow To The Labyrinth,,Odyssey,Attack,AI,Cycle I,Standard,,Labyrinthauros,,III,FALSE,"Closest Titan in front, in range. Closest Titan in sight.",,FALSE,None,,Judgement,,,,,2,9,CourageIcon Courage/WillIcon Will. Each hit deals 3 DangerIcon. WoO Fate 7+ Argo loses -1 CrewIcon.,TRUE,FALSE,Knockback 10. Labyrinth 1. Fate 5+ Labyrinth 2 instead,,
AR0479,Home Run,,Odyssey,Attack,AI,Cycle I,Standard,,Labyrinthauros,,III,TRUE,Closest Titan.,,TRUE,,,Sequential,,,,,3,9,Each hit deals 2 DangerIcon. Fate 7+ 3 DangerIcon instead.,TRUE,FALSE,"If DangerIcon was dealt, repeat Home Run against a Titan that has not been attacked this Round. Repeat until all Titans have been attacked or no DangerIcon was dealt.",,
AR0480,Hone In,,Odyssey,Attack,AI,Cycle I,Standard,,Labyrinthauros,,III,FALSE,"Furthest Titan in front, in range. Furthest Titan in sight, in range. Closest Titan in sight.",,TRUE,,,Regular,,Fate 7+ +1 d10Icon,,,2,8,Each hit deals 3 DangerIcon.,TRUE,FALSE,Trample. Labyrinth 1.,,
AR0481,True Horn Of The Other Side,,Odyssey,Attack,AI,Cycle I,Standard,,Labyrinthauros,,III,FALSE,"Priority Target in range. Closest Knocked down Titan in front, in range. Closest Titan in sight.",,TRUE,Move,,Regular,,,,,2,9,Each hit deals 3 DangerIcon. Fate 7+ Draw an Obol instead of a regular Trauma Draw.,TRUE,FALSE,Labyrinth 1. WoO Trample. Labyrinth 1.,,
AR0482,Instinctive Ram,,Odyssey,Attack,Signature,Cycle I,Standard,,Labyrinthauros,,X,FALSE,"Furthest Titan in front, in range. Furthest Titan in sight, in range. Closest Titan in Sight",,TRUE,Move,,Regular,,Fate 3+ +1 d10Icon,,,2,10,Each hit deals 1 DangerIcon,TRUE,FALSE,Trample. Labyrinth 1,,
AR0483,Home Run,The Call,Odyssey,Attack,Routine,Mnestis Theatre,Standard,,Labyrinthauros,,X,FALSE,Closest Titan. No Target: Random Titan dies,,TRUE,,,Sequential,,,,,3,9,Each hit deals 2 DangerIcon. Fate 7+ 3 DangerIcon instead.,TRUE,FALSE,"If DangerIcon was dealt, repeat Routine against a Titan that has not been attacked this Round. Repeat until all Titans have been attacked or no DangerIcon was dealt.",,
AR0522,Right Tentacle Swipe,,Odyssey,Attack,AI,Cycle I,Standard,,Alpha Temenos,,I,FALSE,"Closest Titan in front, in range. Closest Titan in sight.",WoO Gain 1 Despair token.,TRUE,Move,,Zone,,Fate 3+ +1 Despair token,,,3,10,Each hit deals 2 DangerIcon. Knockdown.,TRUE,TRUE,Knockback 8 to the left. Labyrinth 1.,,
AR0523,Left Tentacle Swipe,,Odyssey,Attack,AI,Cycle I,Standard,,Alpha Temenos,,I,FALSE,"Closest Titan in front, in range. Closest Titan in sight.",WoO Gain 1 Despair token.,TRUE,Move,,Zone,,Fate 3+ +1 Despair token,,,3,10,Each hit deals 2 DangerIcon. Knockdown.,TRUE,TRUE,Knockback 8 to the right. Labyrinth 1.,,
AR0524,Foretentacle Smash,,Odyssey,Attack,AI,Cycle I,Standard,,Alpha Temenos,,I,FALSE,"Priority Target in range. Closest Titan in front, in range. Closest Titan in sight.",WoO Gain 1 Despair token.,TRUE,Move,,Zone,,Fate 3+ +1 Despair token,,,2,9,Each hit deals 2 DangerIcon. Knockdown.,TRUE,TRUE,Labyrinth 1.,,
AR0525,Tentacle Lash,,Odyssey,Attack,AI,Cycle I,Standard,,Alpha Temenos,,I,FALSE,"Titan on Vantage Point. Closest Titan in front, in range. Closest Titan in sight.",WoO Gain 1 Despair token.,TRUE,Move,,Regular,,Fate 3+ +1 Despair token,,,3,9,Each hit deals 2 DangerIcon.,TRUE,FALSE,Knockback 8.,,
AR0526,Small Pyramid,,Odyssey,Attack,AI,Cycle I,Standard,,Alpha Temenos,,I,FALSE,"Closest Titan in front, in range. Closest Titan in sight.",WoO Gain 1 Despair token.,TRUE,Move,,Zone,,Fate 3+ +1 d10Icon,,,4,8,Each hit deals 1 DangerIcon.,TRUE,TRUE,Labyrinth 1.,,
AR0527,Maze Breath,,Odyssey,Attack,AI,Cycle I,Standard,,Alpha Temenos,,I,FALSE,"Priority Target in range. Closest Titan in front, in range. Closest Titan in sight.",WoO Gain 2 Despair tokens.,TRUE,Move,,Regular,,Fate 3+ +1 d10Icon,,,2,8,Each hit deals 3 DangerIcon and 2 FateIcon. WoO Gain the Fear Condition card.,TRUE,FALSE,Labyrinth 1.,,
AR0528,Tentacle Toss,,Odyssey,Attack,AI,Cycle I,Standard,,Alpha Temenos,,II,FALSE,"Titan on Vantage Point. Priority Target in range. Closest Titan in front, in range. Closest Titan in sight.",WoO Gain 1 Despair token.,TRUE,Move,,Regular,,Fate 5+ +1 Despair token,,,3,9,Each hit deals 2 DangerIcon. Fate 4+ 3 DangerIcon instead.,TRUE,FALSE,Knockback 10.,,
AR0529,Tentacle Strangle,,Odyssey,Attack,AI,Cycle I,Standard,,Alpha Temenos,,II,FALSE,"Titan on Vantage Point. Priority Target in range. Closest Titan in front, in range. Closest Titan in sight.",WoO Gain 1 Despair token.,TRUE,Move,,Regular,,Fate 4+ +1 d10Icon,,,2,8,Each hit deals 3 DangerIcon.,TRUE,FALSE,Labyrinth 1.,,
AR0530,Pyramid,,Odyssey,Attack,AI,Cycle I,Standard,,Alpha Temenos,,II,FALSE,"Closest Titan in front, in range. Closest Titan in sight.",WoO Gain 1 Despair token.,TRUE,Move,,Zone,,Fate 5+ +1 Despair token,,,4,8,Each hit deals 2 DangerIcon.,TRUE,TRUE,Labyrinth 1.,,
AR0531,Foretentacle Quad,,Odyssey,Attack,AI,Cycle I,Standard,,Alpha Temenos,,II,FALSE,"Closest Titan in front, in range. Closest Titan in sight.",WoO Gain 2 Despair tokens.,TRUE,Move,,Zone,,Fate 3+ +1 d10Icon,,,3,9,Each hit deals 2 DangerIcon.,TRUE,TRUE,Labyrinth 1.,,
AR0532,Submerge,,Odyssey,Attack,AI,Cycle I,Standard,,Alpha Temenos,,II,FALSE,All Titans on Labyrinth tiles. No Target: Perform Signature,WoO Gain 1 Despair token.,TRUE,None,,,,Fate 5+ +1 Despair token,,,3,8,Each hit deals 2 DangerIcon. Fate 5+ 3 DangerIcon instead. WoO Knockdown.,TRUE,TRUE,Remove Labyrinth tiles under Targets. WoO Perform Routine. WoO Move adjacent to the furthest Titan.,,
AR0533,Maze Light,,Odyssey,Attack,AI,Cycle I,Standard,,Alpha Temenos,,II,FALSE,"Priority Target in range. Closest Titan in front, in range.",WoO Gain 1 Despair token.,TRUE,Move,,Regular,,Fate 5+ +1 d10Icon,,,2,6,"If hit, draw an Obol. WoO Gain the Fear Condition card.",TRUE,FALSE,Knockback 10.,,
AR0534,Starfish Headbutt,,Odyssey,Attack,AI,Cycle I,Standard,,Alpha Temenos,,III,FALSE,"Closest Titan in front, in range. Closest Titan in sight.",WoO Gain 1 Despair token.,TRUE,Move,,Zone,,Fate 7+ +1 Despair token,,,5,7,Each hit deals 2 DangerIcon and 1 FateIcon. WoO Knockdown.,TRUE,TRUE,Labyrinth 1.,,
AR0535,Mazerain,,Odyssey,Attack,AI,Cycle I,Standard,,Alpha Temenos,,III,TRUE,All Titans on Labyrinth tiles. No Target: Perform Signature,WoO Gain 1 Despair token.,TRUE,None,,,,Fate 6+ +1 d10Icon,,,2,10,"Each hit deals 4 DangerIcon. WoO Place a Labyrinth tile under the Target (for each placement choose a shape currently marked on the Labyrinth track, then move the token to the next space).",TRUE,TRUE,Perform Routine,,
AR0536,Giant Pyramid,,Odyssey,Attack,AI,Cycle I,Standard,,Alpha Temenos,,III,FALSE,"Closest Titan in front, in range. Closest Titan in sight. No Target: Perform Signature.",WoO Gain 1 Despair token.,TRUE,Move,,Zone,,Fate 7+ +1 Despair token,,,4,8,Each hit deals 3 DangerIcon.,TRUE,TRUE,Labyrinth 1.,,
AR0537,Great Submerge,,Odyssey,Attack,AI,Cycle I,Standard,,Alpha Temenos,,III,FALSE,All Titans on Labyrinth tiles. No Target: Perform Signature,WoO Gain 1 Despair token.,TRUE,None,,,,,,,3,8,"If hit, draw an Obol. WoO Knockdown. WoO gain +1 DangerIcon.",TRUE,TRUE,Remove all Labyrinth tiles,,
AR0538,Emerge,,Odyssey,Attack,AI,Cycle I,Standard,,Alpha Temenos,,III,FALSE,"Closest Titan in front, in range. Closest Titan in sight.",WoO Gain 2 Despair tokens.,TRUE,Move,,Zone,,,,,3,8,Each hit deals 3 DangerIcon. Fate6+ 4 DangerIcon instead.,TRUE,TRUE,"Place a Labyrinth tile under each Titan in Zone 2 (for each placement choose a shape currently marked on the Labyrinth track, then move the token to the next space).",,
AR0539,Devour,,Odyssey,Attack,AI,Cycle I,Standard,,Alpha Temenos,,III,FALSE,"Titan on Vantage Point. Priority Target in range. Closest Titan in front, in range. Closest Titan in sight.",WoO Gain 2 Despair tokens.,TRUE,Move,,Regular,,,,,2,9,"If hit, raise DangerIcon to 9 and resolve a Trauma Draw. Fate 8+ You die instead. WoO Gain the Fear Condition card.",TRUE,FALSE,Knockback 10.,,
AR0540,Tentacle Strike,,Odyssey,Attack,Signature,Cycle I,Standard,,Alpha Temenos,,X,FALSE,"Furthest Titan not in front, in range. Furthest Titan in range. Titan on Vantage Point. Closest Titan in sight.",,FALSE,Move,,Regular,,Fate 4+ +1 d10Icon,,,3,10,Each hit deals 2 DangerIcon.,TRUE,FALSE,Labyrinth 1.,,
BR0725,Throwing Punches,,Odyssey,Attack,AI,Cycle II,Standard,,Cyclonus,,I,FALSE,All adjacent Titans,,TRUE,None,,Simultaneous,,Fate 3+ Exhaust your ArmorIcon,,,2,9,Each hit deals 2 DangerIcon,TRUE,TRUE,Target with the most DangerIcon suggers Knockback 7 towards the closest short Board Edge. WoO Pushback 3,,
BR0726,Basher,,Odyssey,Attack,AI,Cycle II,Standard,,Cyclonus,,I,FALSE,"Last to Wound in sight, in range. Closest Titan in front, in range. Closest Titan in sight",,TRUE,Move,,Regular,,,,,2,10,"If the Attack hits, it deals 3 DangerIcon. Fate 4+ 4 DangerIcon instead",TRUE,FALSE,Pushback 2. Gain +1 RageIcon,,
BR0727,Head To Head,,Odyssey,Attack,AI,Cycle II,Standard,,Cyclonus,,I,FALSE,"Titan in Blindspot. Closest Titan in front, in range",,TRUE,Move,,Regular,,,,,2,8,"If the Attack hits, it deals 4 DangerIcon. Gain +1 RageIcon. Fate 4+ +2 RageIcon instead",FALSE,FALSE,Pushback 2. Perform a Kratos Roll,,
BR0728,Maul Hook,,Odyssey,Attack,AI,Cycle II,Standard,,Cyclonus,,I,FALSE,"Titan in Blindspot. Closest Titan in front, in range. Closest Titan in sight",,TRUE,Move,,Regular,,Fate 4+ Exhaust your ArmorIcon,,,3,9,Each hit deals 1 DangerIcon. Gain +1 RageIcon. WoO Knockdown,FALSE,FALSE,Knockback 7 towards the closest short Board Edge,,
BR0729,Chain Whip,,Odyssey,Attack,AI,Cycle II,Standard,,Cyclonus,,I,FALSE,"Furthest Titan in front, in range. Furthest Titan in sight, in range",,FALSE,None,,Range,6,Fate 3+ Exhaust your ArmorIcon,,,3,9,One hit deals 1 DangerIcon; Two hits deal 3 DangerIcon; Three hits deal 5 DangerIcon,TRUE,FALSE,Pull 2 per hit,,
BR0730,Monstrous Bite,,Odyssey,Attack,AI,Cycle II,Standard,,Cyclonus,,I,FALSE,"Titan in Blindspot. Closest Titan in front, in range. Closest Titan in sight",,FALSE,Move,,Regular,,Level 4+ +1 d10Icon,,,1,11,"Fate 4+ Gain +1 Rage. If the Attack hits, it deals 5 DangerIcon. WoO Pull 4",FALSE,FALSE,,,
BR0731,Knockout Punch,,Odyssey,Attack,AI,Cycle II,Standard,,Cyclonus,,II,FALSE,"Titan in Blindspot. Last to Wound in sight, in range. Closest Titan in sight",,FALSE,Move,,Regular,,Fate 5+ Exhaust your ArmorIcon,,,3,10,"Gain +1 RageIcon. If the Attack hits, it deals 5 DangerIcon",TRUE,FALSE,Knockback 10 towards the closest short Board Edge. WoO Pushback 4,,
BR0732,Rage Uppercut,,Odyssey,Attack,AI,Cycle II,Standard,,Cyclonus,,II,FALSE,"Last to Wound in sight, in range. Closest Titan in sight",,TRUE,Move,,Regular,,,,,3,9,"Gain +1 RageIcon. Fate 5+ +2 RageIcon instead. If the Attack hits, it deals as many DangerIcon as you have RageIcon. WoO Knockdown",TRUE,FALSE,Forced Vault. Discard Footwear GearIcon. Pushback 2,,
BR0733,Ground Zero,,Odyssey,Attack,AI,Cycle II,Standard,,Cyclonus,,II,FALSE,All adjacent Titans,,TRUE,None,,Simultaneous,,,,,4,10,Each hit deals 1 DangerIcon. WoO Fate 5+ Exhaust your ArmorIcon,TRUE,TRUE,Target with the most DangerIcon suffers Knockback 8 towards the closest short Board Edge,,
BR0734,Ball Trick,,Odyssey,Attack,AI,Cycle II,Standard,,Cyclonus,,II,FALSE,"Furthest Titan in front, in range. Furthest Titan in sight",,FALSE,None,,Range,6,Level 4+ Range +2,,,2,9,Fate 6+ Exhaust your Weapon. Each hit deals 3 DangerIcon,TRUE,FALSE,Pull 3 per hit,,
BR0735,Chain Garrote,,Odyssey,Attack,AI,Cycle II,Standard,,Cyclonus,,II,FALSE,Titan in Blindspot. Last to Wound in sight. Closest Titan in sight,,TRUE,Move,,Regular,,Fate 6+ +1 d10Icon,,,2,8,"Gain +2 RageIcon. One hit deals 3 DangerIcon; two hits deal 5 DangerIcon; three hits , raise DangerIcon to 9, draw a Kratos card instead of a Trauma card",TRUE,FALSE,"If DangerIcon was dealt, Pull 4",,
BR0736,Figurehead Skewer,,Odyssey,Attack,AI,Cycle II,Standard,,Cyclonus,,II,FALSE,"Furthest Titan in front, in range. Furthest Titan in sight",,TRUE,Move,,Regular,,Fate 5+ +1 d10Icon,,,3,7,Gain +2 RageIcon. Each hit deals 2 DangerIcon. WoO Pushback 5,TRUE,FALSE,Pushback 2,,
BR0737,Drop The Ball,,Odyssey,Attack,AI,Cycle II,Standard,,Cyclonus,,III,FALSE,All adjacent Titans,,TRUE,None,,Simultaneous,,Fate 7+ +1 d10Icon. Level 4+ +1 d10Icon,,,1,10,"Fate 6+ Exhaust all your GearIcon. If the Attack hits, it deals 7 DangerIcon. Gain RageIcon equal to the Primordial LVL",FALSE,TRUE,Target with the most DangerIcon suffers Knockback 10 towards the closest short Board Edge,,
BR0738,Old Ball And Chain,,Odyssey,Attack,AI,Cycle II,Standard,,Cyclonus,,III,FALSE,"Furthest Titan in front, in range. Furthest Titan in sight, in range",,TRUE,None,,Range,7,Level 4+ Range +2,,,3,9,Fate 6+ Exhaust all your GearIcon. Each hit deals 3 DangerIcon. Gain RageIcon equal to the Primordial LVL,FALSE,FALSE,Pull 3 per hit,,
BR0739,Gutmaul,,Odyssey,Attack,AI,Cycle II,Standard,,Cyclonus,,III,FALSE,"Titan in Blindspot. Last to Wound in sight, in range. Closest Titan in sight",,FALSE,Move,,Regular,,Fate 6+ +1 d10Icon,,,3,9,Gain +1 RageIcon per hit. The Attack deals as many DangerIcon as you have RageIcon,TRUE,FALSE,Pushback 3,,
BR0740,Ghostpunch,,Odyssey,Attack,AI,Cycle II,Standard,,Cyclonus,,III,TRUE,"Last to Wound in sight, in range. PriorityTargetIcon Priority Target in range. Closest Titan in front, in range",,TRUE,Move,,Regular,,Fate 7+ +1 d10Icon,,,3,9,"One hit deals 5 DangerIcon. Two hits, draw an Obol. Three hits, you die",FALSE,FALSE,Exhaust all your GearIcon. Forced Vault. Cyclonus moves 4 spaces directly away from the Target,,
BR0741,Headshot,,Odyssey,Attack,AI,Cycle II,Standard,,Cyclonus,,III,FALSE,"Last to Wound in sight, in range. PriorityTargetIcon Priority Target in range. Closest Titan in front, in range. Closest Titan in sight",,TRUE,Move,,Regular,,Fate 5+ +1 d10Icon. Level 4+ +1d10Icon,,,1,10,"If the Attack hits and you have a Helm or Headgear, it deals 5 DangerIcon and you discard that GearIcon. Otherwise, gain 9 DangerIcon and, regardless of Trauma Level, perform an Obol Draw",TRUE,FALSE,Knockdown. Gain +2 RageIcon. Knockback 15 towards the closest short Board Edge. Discard Footwear GearIcon,,
BR0742,Compactor,,Odyssey,Attack,AI,Cycle II,Standard,,Cyclonus,,III,FALSE,"Closest Titan in front, in range. Closest Titan in sight",,TRUE,Move,,Regular,,,,,3,8,Each hit deals 3 DangerIcon. Exhaust all your GearIcon. Fate 6+ Gain +2 RageIcon,TRUE,FALSE,Forced Vault. Pushback 3,,
BR0743,Maul Smash,,Odyssey,Attack,Signature,Cycle II,Standard,,Cyclonus,,X,FALSE,"Closest Titan in front, in range. Closest Titan in sight",,TRUE,Move,,Regular,,,,,2,10,Each hit deals 2 DangerIcon. Perform a Kratos Roll,TRUE,FALSE,Knockback 7 towards the closest short Board Edge,,
