Card ID,Name,Reverse Name,Game,Card Type,Subtype,Cycle,Card Size,Found In,Used For,Flavor,Level,Uber?,Targeting,Pre-Action Effects,Pre-Action WoO?,Move Type,Pre-Attack Effect,Attack Type,Range Size,Attack Banners,Attack Diagram,Laser Count,Dice,Difficulty,Attack Consequences,Pre-After Attack WoO?,After Final?,After Attack Effects,FAQ,Errata
CV1795,Embrace the Light,,Odyssey,Attack,AI,Cycle III,Standard,Envelope Alpha,The Pitiless,Bask in the light of your god returned,I,FALSE,Embrace Zone,,TRUE,None,,"Judgement, Zone",,,,,3,11,"Chosen Skill. If you are hit, draw an Obol",FALSE,FALSE,Burn,,
CV1796,Trigger Finger,,Odyssey,Attack,AI,Cycle III,Standard,Envelope Alpha,The Pitiless,Cease to be,I,FALSE,Closest Titan in sight,,TRUE,Move Lateral,,"Laser, Judgement",,,,1,2,11,"Chosen Skill. If you are hit, draw an Obol",FALSE,FALSE,Burn,,
CV1797,Fatherly Pat,,Odyssey,Attack,AI,Cycle III,Standard,Envelope G,The Pitiless,I forgive you,II,FALSE,Closest Titan in sight,,TRUE,Move,,Regular,,,,,4,8,Each hit deals 6 DangerIcon,TRUE,FALSE,Knockdown. Knockback 15,,
CV1798,Deny Grace,,Odyssey,Attack,AI,Cycle III,Standard,Envelope G,The Pitiless,"It is not for you, blasphemer",II,FALSE,Denial Zone,,TRUE,None,,"Zone, Judgement",,,,,3,9,"Chosen Skill. If you are hit, you are incinerated",FALSE,FALSE,Burn,,
CV1799,Glorious Fire,,Odyssey,Attack,AI,Cycle III,Standard,Envelope G,The Pitiless,Let the impurities burn away,II,FALSE,Unshaded Board,,TRUE,None,,"Sun, Judgement",,,,,2,11,"Chosen Skill. If you are hit, you are incinerated",FALSE,FALSE,Burn,,
CV1800,Trigger Finger,,Odyssey,Attack,AI,Cycle III,Standard,Envelope G,The Pitiless,Disappear,II,TRUE,Closest Titan in sight,,TRUE,Move Lateral,,"Laser, Judgement",,,,1,2,11,"Chosen Skill. If you are hit, you are incinerated",FALSE,FALSE,Burn,,
CV1801,I am the Sun,,Odyssey,Attack,AI,Cycle III,Standard,Envelope U,The Pitiless,I am the life giver,III,FALSE,All Titans,,TRUE,None,,Simultaneous,,,,,,,This attack cannot be canceled or ignored in any way. All Titans are incinerated. This death is unavoidable. Return to 0203,FALSE,FALSE,,,
CV1802,God's Love,,Odyssey,Attack,Signature,Cycle III,Standard,Envelope 1,The Pitiless,Worship me,X,FALSE,Closest Titan in sight,,TRUE,Move Lateral,,Judgement,,,,,2,11,"Chosen Skill. If you are hit, you are incinerated",FALSE,FALSE,Burn,,
CV1803,God's Justice,,Odyssey,Attack,Routine,Cycle III,Standard,Envelope 1,The Pitiless,Fear me,X,FALSE,Closest Titan. No Target: Random Titan dies,,TRUE,Move Lateral,,Judgement,,,,,2,11,"Chosen Skill. If you are hit, you are incinerated",FALSE,FALSE,Burn,,
CV1804,Merciless Sun,,Odyssey,Attack,Trait Attack,Cycle III,Standard,Envelope S,The Pitiless,Proceed... on your way to oblivion,X,FALSE,Unshaded Board,,TRUE,None,Turn to face the most titans,Sun,,,,,3,10,Each hit deals 3 DangerIcon and 1 FateIcon,TRUE,TRUE,Glaciate the Time Anchor of the Titan with the lowest FateIcon. Rewind the Titan with the highest FateIcon,,
DV2540,Finger Snap,,Odyssey,Attack,AI,Cycle IV,Standard,Envelope Y,Old Haunt,<SNAP>,I,FALSE,Closest Titan in sight,,TRUE,None,,Range,Unlimited,,,,2,10,"If you are hit, draw an Obol",FALSE,FALSE,Burn,,
DV2541,Obedience Aura,,Odyssey,Attack,AI,Cycle IV,Standard,Envelope Y,Old Haunt,My loving flock. My cattle,I,FALSE,Embrace Zone,,FALSE,None,,"Zone, Judgement",,,,,4,10,"Chosen Skill. If you are hit, draw an Obol",FALSE,FALSE,Destroy all Terrain tiles in the Zone,,
DV2542,Blessing Hand,,Odyssey,Attack,AI,Cycle IV,Standard,Envelope Y,Old Haunt,"Love me, and you will be blessed in the next life",II,FALSE,Closest Titan in sight,,TRUE,Move Lateral,,"Laser, Judgement",,,,2,2,11,"Chosen Skill. If you are hit, you are incinerated",FALSE,FALSE,Burn,,
DV2543,"Kneel, Heathens",,Odyssey,Attack,AI,Cycle IV,Standard,Envelope Y,Old Haunt,And accept my love and judgement,II,FALSE,Denial Zone,,TRUE,None,,"Zone, Judgement",,,,,3,9,"Chosen Skill. If you are hit, Knockdown, then drawn an Obol",FALSE,FALSE,Burn,,
DV2544,I Was the Sun,,Odyssey,Attack,AI,Cycle IV,Standard,Envelope Y,Old Haunt,I am the life giver,III,FALSE,Each Titan,,TRUE,None,,Simultaneous,,,,,,,"When this AI card is revealed, leave it on top and end the Primordial Round. If it is already revealed at the start of the Primordial Round, perform it. Each Titan is incinerated",FALSE,FALSE,,,
DV2545,Witness Me,,Odyssey,Attack,AI,Cycle IV,Standard,Envelope Y,Old Haunt,Bear witness,III,FALSE,Denial Zone,,FALSE,None,,"Zone, Judgement",,,,,3,10,"Chosen Skill. If you are hit, Knockdown, then draw an Obol",FALSE,FALSE,Destroy all Terrain tiles in Zone 3,,
DV2546,Five Fingers of Doom,,Odyssey,Attack,AI,Cycle IV,Standard,Envelope Y,Old Haunt,You're already dead,III,FALSE,PriorityTargetIcon Priority Target in sight,,TRUE,Move Lateral,,"Judgement, Laser",,,,Omni,3,11,"Chosen Skill. If the Laser Attack hits a Terrain tile, it continues sideways. If you are hit, you are incinerated",FALSE,FALSE,Burn,,
DV2547,Excommunicate,,Odyssey,Attack,AI,Cycle IV,Standard,Envelope Y,Old Haunt,Leave My Grace and be doomed forever,III,FALSE,Denial Zone,,TRUE,None,,Judgement,,,,,2,10,"Chosen Skill. If you are hit, you are incinerated",FALSE,FALSE,Destroy all Terrain tiles in Zone 3,,
DV2548,Sundown,,Odyssey,Attack,AI,Cycle IV,Standard,Envelope Y,Old Haunt,Starve,III,FALSE,This Laser Attack is resolved from each side of every Irem Tower Terrain tile in cardinal directions,,TRUE,None,,Laser,,,,,4,9,"If you are hit, you are incinerated",FALSE,FALSE,Burn,,
DV2549,Sunrise,,Odyssey,Attack,AI,Cycle IV,Standard,Envelope Y,Old Haunt,Bask,III,FALSE,This Laser Attack is resolved in all Rows from the left and toward the right Board Edge,,TRUE,None,,Laser,,,,,4,9,"If you are hit, you are incinerated",FALSE,FALSE,Burn,,
DV2569,Merciless Sun,,Odyssey,Attack,Trait Attack,Cycle IV,Standard,Envelope Y,Old Haunt,Proceed... on your way to oblivion,X,FALSE,Unshaded Board,,TRUE,None,Turn to face the most titans,Sun,,,,,3,10,Each hit deals 3 DangerIcon and 1 FateIcon,TRUE,TRUE,Wish Away 12 the Titan with the lowest FateIcon. Titan with the highest FateIcon suffers Midas 1,,